{"candidate_manifest_sha256":"94466c0f1efed64b6e0c5e8ea8e6b3ed5a4537c4a5e44576a2d081b9f409f501","counts":{"double_owned_cells":0,"model_instruments":3,"source_cells":83,"source_rows":4,"term_authorities":45,"unowned_cells":0,"violations":0},"crosswalk_sha256":"8fe2f8a3e1cb40a0090fe5b5ea4d70abcb1dbcf001bf3e80cf37d23d6d71630a","projection_sha256":"e3a9f7a83d52f62dba58c969da3fa6af420a78cbbfbbf57a666b9afe5fb0c828","schema_version":"dcs-evidence-receipt/1.0","source_sha256":"88c6fb33dd764e2dcede851fe0da825624bc11a4dce77249281d46dd04f61180","source_tables_sha256":"5f091c8ca63839100a95cbcd9aac6733c8b48287d3ec503ec17aa79953934dd1","status":"PASS","violations":[]}
