{"candidate_manifest_sha256":"94466c0f1efed64b6e0c5e8ea8e6b3ed5a4537c4a5e44576a2d081b9f409f501","counts":{"double_owned_cells":0,"model_instruments":3,"source_cells":83,"source_rows":4,"term_authorities":45,"unowned_cells":0,"violations":1},"crosswalk_sha256":"ce370965fdb46ab107319eab5a03310067d83ed10b9553cb1466cf16a1ed1b23","projection_sha256":"4f6358123e270e49c6f7c2d2d23bee83db0d2f0d1f974fcb27e48cbc33d5aeee","schema_version":"dcs-evidence-receipt/1.0","source_sha256":"88c6fb33dd764e2dcede851fe0da825624bc11a4dce77249281d46dd04f61180","source_tables_sha256":"5f091c8ca63839100a95cbcd9aac6733c8b48287d3ec503ec17aa79953934dd1","status":"BLOCKED","violations":[{"code":"DCS-SCHEMA-CONTRACT","message":"crosswalk fails dcs-crosswalk-v1.schema.json: $: unexpected property unexpected_field"}]}
